1,108,「心動」與「行動」,「心動不如馬上行動」原是廣告金句，今天已廣泛運用於日常生活。 其實，「心動」和「行動」之間，距離可從 0 到無限大，因人、因事、因時而異。於是， 「心動……行動」可能衍生出幾種觀點，例如： A.「心動是不夠的，最好馬上行動」 B.「心動就好，其實不用行動」 C.「心動可能只是衝動，不應馬上行動」 請結合你的生活經驗與觀察，探討「心動」與「行動」的關係，寫一篇完整的文章。 你可以參採廣告金句或 A、B、C 的觀點，也可以提出自己不同的看法。文章不用訂題目。,https://www.tcte.edu.tw/download/desel/
2,106,關於物美價廉，我的看法是……,請結合你的日常生活經驗與所知，以「關於物美價廉，我的看法是……」為題，寫一篇完整的文章。,https://www.tcte.edu.tw/download/desel/
3,105,怎麼會是我,抽到眾人想得到的大獎，可能會開心地自問：「怎麼會是我？」莫名其妙被推舉為班長，可能會驚訝地問同學：「怎麼會是我？」在一場意外中受傷，可能會哀怨地問上天：「怎麼會是我？」「怎麼會是我？」崇禎皇帝憾恨自己被大臣所誤，束手看著朝廷覆亡；「怎麼會是我？」孫悟空一度疑惑，最終堅定地協助唐三藏完成夢想。人生總有些事，突如其來得沒法抵擋，但手中可能因此多了些選項，心智也會因此多一分增長。請以「怎麼會是我」為題，寫一篇完整的文章，述說你的經驗、體會或看法。,https://www.tcte.edu.tw/download/desel/
4,102,放大鏡,拿著放大鏡，可以顯示微小的東西，讓我們看清事物的形象。世上除了各式各樣有形的放大鏡，也有無形的放大鏡存在我們心中 —— 觀察別人、檢視自己、分辨人性善惡、欣賞大千世界。在放大鏡下，輪廓樣貌或細微末節，因著焦距的改變，會突顯或扭曲，導致不同的判斷，帶來不一樣的理解。請以「放大鏡」為題，撰寫一篇完整的文章，敘述與放大鏡相關有形或無形的體察與見解。,https://www.tcte.edu.tw/download/desel/
5,101,問心無愧,人們無論針對過去種種、目前當下，或規劃未來，大大小小的行事作為，都可以透過 道德良心加以檢驗或省思，所得到的結論，理應是自覺坦蕩，而不是慚愧羞赧。包含對人、 對事、對物，甚至是對天地良心，都應該時時自我省思，自我惕勵。如果人人重視這把道德 的尺，對自己，對別人，甚至對國家社會，都有可能發揮不小的影響力。 請以「問心無愧」為題，書寫一篇完整的文章，敘述相關體驗、事例，或論說此一道理。,https://www.tcte.edu.tw/download/desel/
6,100,善意，在手中,善意，發自內心，但在給予他人之前，你有什麼考慮 ── 是喜歡公開給人幫助？還是 只想默默付出？是直覺應該時時的、毫不吝嗇的給？還是認為應該視狀況、看時機來給？ 又或者，你曾握著善意，卻遲遲沒給出去 ── 可能擔心，給了，和別人的一比顯得卑微；可能 操心，給了，未必是對方真正的需求；也可能憂心，給了，反而造成對方的尷尬、或 誤會…… 請以「善意，在手中」為題，寫一篇完整的文章，述說你的相關經驗、感想或看法。,https://www.tcte.edu.tw/download/desel/
